What is Shakespeare famous for ?; His plays; His operas; His paintings;
What is the traditional dessert you would eat at Christmas in England ?; Porridge; Pudding; Crumble;
What are the nations composing the United Kingdom ?; England, Ireland, Iceland and Scotland; England, Scotland, Wales and Ireland; England, Northern Ireland, Wales and Scotland;
New York is also referred to as the :; Big Orange; City of Angels; Big Apple; Big Cherry;
How is the anthem of the United KingDom Called ?; The star-spangled banner; God save the Queen; Advance Australia Fair;
What is the name of the river that flows in London ?; Thames; Ribble; Avon;
What is the capital of Australia ?; Sydney; Canberra; Melbourne;